{
  "$schema": "https://json-schema.org/draft/2020-12/schema",
  "title": "通常の記事変更と最終レビューの記録",
  "type": "object",
  "additionalProperties": false,
  "required": ["schema_version", "run_id", "base_sha", "writer_run_id", "completed_at", "changes", "tasks", "sources", "review"],
  "properties": {
    "schema_version": { "const": 1 },
    "run_id": { "type": "string", "pattern": "^[a-z0-9][a-z0-9-]{3,79}$" },
    "base_sha": { "type": "string", "pattern": "^[a-f0-9]{40}$" },
    "writer_run_id": { "type": "string", "minLength": 4, "maxLength": 160 },
    "completed_at": { "type": "string", "pattern": "^\\d{4}-\\d{2}-\\d{2}T\\d{2}:\\d{2}:\\d{2}(?:\\.\\d{1,3})?Z$" },
    "changes": {
      "type": "array", "minItems": 1, "maxItems": 250,
      "items": {
        "type": "object", "additionalProperties": false,
        "required": ["path", "kind", "summary"],
        "properties": {
          "path": { "type": "string", "pattern": "^docs/[0-9]{2}-[a-z0-9-]+/[a-z0-9-]+\\.md$" },
          "kind": { "enum": ["new", "substantive", "reference-only", "editorial", "status-only", "relocate", "remove"] },
          "previous_path": { "type": "string", "pattern": "^docs/[0-9]{2}-[a-z0-9-]+/[a-z0-9-]+\\.md$" },
          "summary": { "type": "string", "minLength": 1, "maxLength": 2000 }
        }
      }
    },
    "tasks": {
      "type": "array", "minItems": 1, "maxItems": 250,
      "items": {
        "type": "object", "additionalProperties": false,
        "required": ["id", "artifacts"],
        "properties": {
          "id": { "type": "string", "minLength": 1, "maxLength": 100 },
          "artifacts": { "type": "array", "minItems": 1, "uniqueItems": true, "items": { "type": "string", "pattern": "^docs/[0-9]{2}-[a-z0-9-]+/[a-z0-9-]+\\.md$" } }
        }
      }
    },
    "sources": {
      "type": "array", "maxItems": 250,
      "items": {
        "type": "object", "additionalProperties": false,
        "required": ["url", "accessed_at", "claim", "affected_docs"],
        "properties": {
          "url": { "type": "string", "minLength": 10, "maxLength": 4096, "pattern": "^https://" },
          "accessed_at": { "type": "string", "pattern": "^\\d{4}-\\d{2}-\\d{2}T\\d{2}:\\d{2}:\\d{2}(?:\\.\\d{1,3})?Z$" },
          "claim": { "type": "string", "minLength": 1, "maxLength": 5000 },
          "affected_docs": { "type": "array", "minItems": 1, "uniqueItems": true, "items": { "type": "string", "pattern": "^docs/[0-9]{2}-[a-z0-9-]+/[a-z0-9-]+\\.md$" } }
        }
      }
    },
    "review": {
      "description": "未公開 draft だけの変更では null。公開済み記事・公開昇格・削除には最終レビューが必要。",
      "oneOf": [
        { "type": "null" },
        {
          "type": "object", "additionalProperties": false,
          "required": ["verdict", "independent", "reviewer_run_id", "reviewed_at", "content_digest"],
          "properties": {
            "verdict": { "enum": ["approved", "changes_requested"] },
            "independent": { "const": true },
            "reviewer_run_id": { "type": "string", "minLength": 4, "maxLength": 160 },
            "reviewed_at": { "type": "string", "pattern": "^\\d{4}-\\d{2}-\\d{2}T\\d{2}:\\d{2}:\\d{2}(?:\\.\\d{1,3})?Z$" },
            "content_digest": { "type": "string", "pattern": "^[a-f0-9]{64}$" }
          }
        }
      ]
    }
  }
}
